--
-- pgstat_opt
--
-- Baseline reset to make stats comparable
SELECT pg_stat_reset();
 pg_stat_reset 
---------------
 
(1 row)

SELECT pg_stat_clear_snapshot();
 pg_stat_clear_snapshot 
------------------------
 
(1 row)

-- Create table and insert initial rows
DROP TABLE IF EXISTS t_pgstat_test;
NOTICE:  table "t_pgstat_test" does not exist, skipping
CREATE TABLE t_pgstat_test(id int primary key, val int) with(autovacuum_enabled = off);
NOTICE:  CREATE TABLE / PRIMARY KEY will create implicit index "t_pgstat_test_pkey" for table "t_pgstat_test"
SELECT pg_stat_force_next_flush();
 pg_stat_force_next_flush 
--------------------------
 
(1 row)

INSERT INTO t_pgstat_test VALUES (1,1);
SELECT pg_stat_force_next_flush();
 pg_stat_force_next_flush 
--------------------------
 
(1 row)

SELECT pg_sleep(1.0);
 pg_sleep 
----------
 
(1 row)

SELECT pg_stat_clear_snapshot();
 pg_stat_clear_snapshot 
------------------------
 
(1 row)

SELECT (COALESCE((SELECT n_tup_ins FROM pg_stat_user_tables WHERE relname='t_pgstat_test'),0) = 1) AS ins_exact;
 ins_exact 
-----------
 t
(1 row)

-- Insert counter should increase to 2
SELECT pg_stat_force_next_flush();
 pg_stat_force_next_flush 
--------------------------
 
(1 row)

INSERT INTO t_pgstat_test VALUES (2,2);
SELECT pg_stat_force_next_flush();
 pg_stat_force_next_flush 
--------------------------
 
(1 row)

SELECT pg_sleep(1.0);
 pg_sleep 
----------
 
(1 row)

SELECT pg_stat_clear_snapshot();
 pg_stat_clear_snapshot 
------------------------
 
(1 row)

SELECT pg_stat_force_next_flush();
 pg_stat_force_next_flush 
--------------------------
 
(1 row)

SELECT (COALESCE((SELECT n_tup_ins FROM pg_stat_user_tables WHERE relname='t_pgstat_test'),0) = 2) AS ins_exact;
 ins_exact 
-----------
 t
(1 row)

-- Update/Delete counters should increase to 1
SELECT pg_stat_force_next_flush();
 pg_stat_force_next_flush 
--------------------------
 
(1 row)

UPDATE t_pgstat_test SET val=val+1 WHERE id=1;
SELECT pg_stat_force_next_flush();
 pg_stat_force_next_flush 
--------------------------
 
(1 row)

DELETE FROM t_pgstat_test WHERE id=2;
SELECT pg_stat_force_next_flush();
 pg_stat_force_next_flush 
--------------------------
 
(1 row)

SELECT pg_sleep(1.0);
 pg_sleep 
----------
 
(1 row)

SELECT pg_stat_clear_snapshot();
 pg_stat_clear_snapshot 
------------------------
 
(1 row)

SELECT (COALESCE((SELECT n_tup_ins FROM pg_stat_user_tables WHERE relname='t_pgstat_test'),0) = 2) AS ins_exact;
 ins_exact 
-----------
 t
(1 row)

SELECT (COALESCE((SELECT n_tup_upd FROM pg_stat_user_tables WHERE relname='t_pgstat_test'),0) = 1) AS upd_exact,
       (COALESCE((SELECT n_tup_del FROM pg_stat_user_tables WHERE relname='t_pgstat_test'),0) = 1) AS del_exact;
 upd_exact | del_exact 
-----------+-----------
 t         | t
(1 row)

-- TRUNCATE should keep live/dead non-negative
TRUNCATE t_pgstat_test;
SELECT pg_stat_clear_snapshot();
 pg_stat_clear_snapshot 
------------------------
 
(1 row)

SELECT (COALESCE((SELECT n_live_tup FROM pg_stat_user_tables WHERE relname='t_pgstat_test'),0) >= 0) AS live_nonneg,
       (COALESCE((SELECT n_dead_tup FROM pg_stat_user_tables WHERE relname='t_pgstat_test'),0) >= 0) AS dead_nonneg;
 live_nonneg | dead_nonneg 
-------------+-------------
 t           | t
(1 row)

-- Function stats path (exact delta)
SET track_functions = 'all';
DROP FUNCTION IF EXISTS f_pgstat_test(int);
NOTICE:  function f_pgstat_test(pg_catalog.int4) does not exist, skipping
CREATE OR REPLACE FUNCTION f_pgstat_test(i int) RETURNS int AS $$
BEGIN
  RETURN i + 1;
END;
$$ LANGUAGE plpgsql;
SELECT pg_stat_reset_single_function_counters('f_pgstat_test(int)'::regprocedure);
 pg_stat_reset_single_function_counters 
----------------------------------------
 
(1 row)

SELECT pg_stat_force_next_flush();
 pg_stat_force_next_flush 
--------------------------
 
(1 row)

SELECT f_pgstat_test(1);
 f_pgstat_test 
---------------
             2
(1 row)

SELECT pg_stat_force_next_flush();
 pg_stat_force_next_flush 
--------------------------
 
(1 row)

SELECT pg_sleep(1.0);
 pg_sleep 
----------
 
(1 row)

SELECT pg_stat_clear_snapshot();
 pg_stat_clear_snapshot 
------------------------
 
(1 row)

SELECT (COALESCE((SELECT calls FROM pg_stat_user_functions WHERE funcname='f_pgstat_test'),0) = 1) AS func_calls_exact;
 func_calls_exact 
------------------
 t
(1 row)

-- Temp file stats path (monotonic)
SELECT pg_stat_reset();
 pg_stat_reset 
---------------
 
(1 row)

SELECT pg_stat_clear_snapshot();
 pg_stat_clear_snapshot 
------------------------
 
(1 row)

SET work_mem='64kB';
WITH before AS (
    SELECT pg_stat_get_db_temp_files(oid) AS files_before,
           pg_stat_get_db_temp_bytes(oid) AS bytes_before
      FROM pg_database WHERE datname=current_database()
),
work AS (
    SELECT count(*) AS temp_count
      FROM (SELECT * FROM generate_series(1,200000) g ORDER BY g) s
),
after AS (
    SELECT pg_stat_get_db_temp_files(oid) AS files_after,
           pg_stat_get_db_temp_bytes(oid) AS bytes_after
      FROM pg_database WHERE datname=current_database()
)
SELECT (after.files_after >= before.files_before) AS temp_files_monotonic,
       (after.bytes_after >= before.bytes_before) AS temp_bytes_monotonic
  FROM before, work, after;
 temp_files_monotonic | temp_bytes_monotonic 
----------------------+----------------------
 t                    | t
(1 row)

-- Reset single table counters
INSERT INTO t_pgstat_test VALUES (3,3);
SELECT pg_stat_clear_snapshot();
 pg_stat_clear_snapshot 
------------------------
 
(1 row)

WITH baseline AS (
    SELECT COALESCE((SELECT n_tup_ins FROM pg_stat_user_tables WHERE relname='t_pgstat_test'),0) AS before
),
reset AS (
    SELECT pg_stat_reset_single_table_counters('t_pgstat_test'::regclass) AS _reset FROM baseline
),
wait AS (
    SELECT pg_sleep(1.0) FROM reset
)
SELECT (COALESCE((SELECT n_tup_ins FROM pg_stat_user_tables WHERE relname='t_pgstat_test'),0) <= (SELECT before FROM baseline)) AS single_table_reset_ok
  FROM wait;
 single_table_reset_ok 
-----------------------
 t
(1 row)

-- Reset single function counters
SELECT f_pgstat_test(2);
 f_pgstat_test 
---------------
             3
(1 row)

SELECT pg_stat_clear_snapshot();
 pg_stat_clear_snapshot 
------------------------
 
(1 row)

WITH baseline AS (
    SELECT COALESCE((SELECT calls FROM pg_stat_user_functions WHERE funcname='f_pgstat_test'),0) AS before
),
reset AS (
    SELECT pg_stat_reset_single_function_counters('f_pgstat_test(int)'::regprocedure) AS _reset FROM baseline
),
wait AS (
    SELECT pg_sleep(1.0) FROM reset
)
SELECT (COALESCE((SELECT calls FROM pg_stat_user_functions WHERE funcname='f_pgstat_test'),0) <= (SELECT before FROM baseline)) AS single_func_reset_ok
  FROM wait;
 single_func_reset_ok 
----------------------
 t
(1 row)

-- Reset database-level counters (exact zero)
WITH baseline AS (
    SELECT COALESCE((SELECT n_tup_ins FROM pg_stat_user_tables WHERE relname='t_pgstat_test'),0) AS before
),
reset AS (
    SELECT pg_stat_reset() AS _reset FROM baseline
),
wait AS (
    SELECT pg_sleep(1.0) FROM reset
)
SELECT (COALESCE((SELECT n_tup_ins FROM pg_stat_user_tables WHERE relname='t_pgstat_test'),0) <= (SELECT before FROM baseline)) AS reset_ok
  FROM wait;
 reset_ok 
----------
 t
(1 row)

-- DROP should remove stats entry
DROP TABLE t_pgstat_test;
SELECT (count(*) = 0) AS drop_removed FROM pg_stat_user_tables WHERE relname='t_pgstat_test';
 drop_removed 
--------------
 t
(1 row)

